{"dt":5.0000000000000003e-02,"horizon":16,"obstacles":[{"center":[4.0000000000000002e-01,0.0000000000000000e+00,2.9999999999999999e-01],"radius":5.0000000000000003e-02,"type":"sphere"}],"scene_id":"scene-1234","seed":1234,"tool_radius":2.0000000000000000e-02,"tracking_reserve":5.0000000000000001e-03,"workspace":{"hi":[8.0000000000000004e-01,4.0000000000000002e-01,5.9999999999999998e-01],"lo":[0.0000000000000000e+00,-4.0000000000000002e-01,0.0000000000000000e+00]}}
