{
  "scene_id": "fixture-scene",
  "obstacles": [
    {
      "type": "sphere",
      "center": [
        0.4,
        0.0,
        0.3
      ],
      "radius": 0.05
    }
  ],
  "workspace": {
    "lo": [
      0.0,
      -0.4,
      0.0
    ],
    "hi": [
      0.8,
      0.4,
      0.6
    ]
  },
  "tool_radius": 0.02,
  "tracking_reserve": 0.005,
  "dt": 0.05,
  "horizon": 16,
  "seed": 1234
}
